esp,ing
"El libro 'Obtenga el sí', escrito por Roger Fisher, William Ury y Bruce Patton, se ha convertido en un pilar fundamental para aquellos que desean perfeccionar sus habilidades de negociación.", "'Getting to Yes,' written by Roger Fisher, William Ury, and Bruce Patton, has become a cornerstone for those who wish to hone their negotiation skills."
"A diferencia de otras guías de negociación, esta obra no se centra en las tácticas tradicionales de regateo o persuasión.", "Unlike other negotiation guides, this work does not focus on traditional bargaining or persuasion tactics."
"Por el contrario, los autores proponen un enfoque más constructivo basado en principios que buscan satisfacer los intereses de ambas partes.", "Instead, the authors propose a more constructive approach based on principles that aim to satisfy the interests of both parties."
"Un aspecto central del libro es la importancia de separar a las personas del problema para evitar que las emociones interfieran en la negociación.", "A key aspect of the book is the importance of separating people from the problem to prevent emotions from interfering in the negotiation."
"Por ejemplo, el libro sugiere que, cuando se enfrenten a una situación difícil, los negociadores deben centrarse en los hechos y no en las intenciones percibidas.", "For instance, the book suggests that when faced with a difficult situation, negotiators should focus on the facts and not on perceived intentions."
"Además, los autores abogan por el uso de preguntas abiertas para explorar los intereses subyacentes de la otra parte, en lugar de cuestionar directamente sus posturas.", "Furthermore, the authors advocate the use of open-ended questions to explore the other party's underlying interests, rather than directly questioning their positions."
"Este tipo de preguntas, como '¿Qué le preocupa de esta propuesta?' no solo abren la conversación, sino que también demuestran empatía y fomentan la colaboración.", "Such questions, like 'What concerns you about this proposal?' not only open up the conversation but also demonstrate empathy and foster collaboration."
"Asimismo, el libro enseña a reformular los comentarios de la otra parte para asegurar que se ha entendido correctamente.", "Similarly, the book teaches how to rephrase the other party's comments to ensure they have been understood correctly."
"Esta técnica, que podría sonar sencilla, resulta fundamental para evitar malentendidos y para mantener un diálogo abierto y respetuoso.", "This technique, which might sound simple, is fundamental for avoiding misunderstandings and maintaining an open and respectful dialogue."
"Por otro lado, los autores también recomiendan explorar opciones creativas antes de tomar una decisión final.", "On the other hand, the authors also recommend exploring creative options before making a final decision."
"Al utilizar esta estrategia, los negociadores tienen la oportunidad de encontrar soluciones innovadoras que beneficien a todos.", "By using this strategy, negotiators have the opportunity to find innovative solutions that benefit everyone."
"El libro explica cómo estas alternativas no solo ayudan a superar los bloqueos en la negociación, sino que también permiten a ambas partes sentir que han alcanzado un acuerdo justo.", "The book explains how these alternatives not only help overcome negotiation deadlocks but also allow both parties to feel they have reached a fair agreement."
"Por ejemplo, en lugar de simplemente ceder a las demandas de la otra parte, se puede sugerir una solución que aborde las preocupaciones de ambas partes.", "For example, instead of simply giving in to the other party's demands, one could suggest a solution that addresses both parties' concerns."
"Este enfoque no solo es efectivo, sino que también promueve relaciones a largo plazo basadas en la confianza y el respeto mutuo.", "This approach is not only effective but also promotes long-term relationships based on trust and mutual respect."
"Un capítulo particularmente interesante es aquel que describe cómo negociar con personas difíciles, como aquellas que se niegan a razonar o que utilizan tácticas de presión.", "A particularly interesting chapter is the one that describes how to negotiate with difficult people, such as those who refuse to reason or who use pressure tactics."
"En lugar de responder con la misma actitud, los autores recomiendan cambiar de táctica y utilizar frases que desarmen a la otra parte, como 'entiendo su punto de vista, pero...'.", "Instead of responding with the same attitude, the authors recommend changing tactics and using phrases that disarm the other party, such as 'I understand your point of view, but...'."
"Esto no solo evita confrontaciones innecesarias, sino que también ayuda a mantener la calma en situaciones tensas.", "This not only avoids unnecessary confrontations but also helps maintain calm in tense situations."
"Además, se sugiere evaluar las opciones propuestas usando criterios objetivos y no opiniones subjetivas.", "Moreover, it is suggested to evaluate the proposed options using objective criteria rather than subjective opinions."
"Por ejemplo, en una negociación de precios, se podría utilizar como referencia el valor de mercado en lugar de la opinión de una de las partes.", "For example, in a price negotiation, one could use the market value as a reference instead of one party’s opinion."
"De esta manera, se evita que la negociación se convierta en una discusión sobre quién tiene la razón y se centra en lo que es razonable para todos.", "In this way, the negotiation avoids becoming an argument about who is right and instead focuses on what is reasonable for everyone."
"En resumen, 'Obtenga el sí' es más que un manual de negociación; es una guía práctica que enseña a comunicarse de manera efectiva y a encontrar soluciones que beneficien a todos los involucrados.", "In summary, 'Getting to Yes' is more than just a negotiation manual; it is a practical guide that teaches how to communicate effectively and find solutions that benefit everyone involved."
