esp,ing
"Lo que intento decir es que tu único límite es la barrera autoimpuesta en tu propia mente.","What I’m trying to say is that your only limit is the self-imposed barrier in your own mind."
"No te detengas hasta que te sientas orgulloso; el camino del guerrero es uno de mejora continua.","Don't stop until you are proud; the warrior's path is one of continuous improvement."
"Como dijo Maquiavelo, es mucho más crucial ser temido que amado si uno no puede ser ambos.","As Machiavelli said, it is much more crucial to be feared than loved if one cannot be both."
"Nietzsche sostenía que lo que no nos mata nos hace más fuertes, convirtiendo cada herida en resiliencia.","Nietzsche maintained that what does not kill us makes us stronger, turning every wound into resilience."
"Para el emprendedor, los reveses no son fracasos, sino sacrificios necesarios para alcanzar la cima.","For the entrepreneur, setbacks are not failures, but necessary sacrifices to reach the peak."
"A diferencia de lo que piensa la masa, el líder debe ser implacable para asegurar su herencia.","Contrary to what the masses think, the leader must be relentless to ensure their heritage."
"Esta experiencia me enseñó que la moralidad a veces es una barrera autoimpuesta que limita nuestro potencial.","This experience taught me that morality is sometimes a self-imposed barrier that limits our potential."
"Un guerrero debe aprender a valerse por sí mismo, pues depender de otros es una debilidad fatal.","A warrior must learn to stand on their own 2 feet, as relying on others is a fatal weakness."
"Mirando hacia atrás, me doy cuenta de que el caos es esencial para que nazca una estrella danzante.","Looking back, I realize that chaos is essential for a dancing star to be born."
"Para ser perfectamente franco, el éxito a menudo requiere que ocultemos nuestras verdaderas intenciones.","To be perfectly frank, success often requires us to hide our true intentions."
"No dejes que la desilusión te detenga; el individuo superior crea su propio sentido de satisfacción.","Don't let disillusionment stop you; the superior individual creates their own sense of fulfillment."
"Teniendo todo en cuenta, es mejor ser un león que una oveja en el implacable mundo de los negocios.","Taking everything into account, it is better to be a lion than a sheep in the relentless world of business."
"Lo que intento decir es que debemos reevaluar todos los valores que hemos dado por sentados.","What I’m trying to say is that we must reassess all the values we have taken for granted."
"El impacto de un gran hombre en la historia es tan profundo que justifica cualquier dificultad sufrida.","The impact of a great man on history is so profound that it justifies any hardships endured."
"Si tuviera que adivinar, diría que el poder pertenece a aquellos que se atreven a superar su propia duda.","If I had to guess, I’d say power belongs to those who dare to overcome their own self-doubt."
"Sinceramente, la búsqueda de la verdad requiere una voluntad que sea tanto vertical como inquebrantable.","Honestly, the search for truth requires a will that is both upright and unwavering."
"Incluso en medio de la fatiga, el espíritu del guerrero busca alcanzar nuevas profundidades de conocimiento.","Even in the midst of fatigue, the warrior's spirit seeks to reach new depths of knowledge."
"Esa es una pregunta compleja. Maquiavelo habría argumentado que el líder debe idear un plan para asegurar el poder.","That’s a complex question. Machiavelli would have argued that the leader must come up with a plan to secure power."
"Para ser perfectamente franco, si uno no hubiera soportado dificultades, nunca habría desarrollado verdadera resiliencia.","To be perfectly frank, if one had not endured hardships, they would never have developed true resilience."
"Lo que intento decir es que debemos dejar de dar por sentada la moralidad tradicional y reevaluar nuestra fuerza.","What I’m trying to say is that we must stop taking traditional morality for granted and reassess our strength."
"A medida que pasaba el tiempo, Nietzsche se dio cuenta de que la mayoría de los valores humanos eran barreras autoimpuestas.","As time went on, Nietzsche realized that most human values were self-imposed barriers."
"Si tuviera que adivinar, diría que el príncipe exitoso es aquel que logra lidiar con la traición sin vacilar.","If I had to guess, I’d say the successful prince is the one who manages to deal with betrayal without hesitating."
"Curiosamente, un guerrero no se rinde ante un revés; sigue adelante hasta alcanzar su pleno cumplimiento personal.","Interestingly enough, a warrior doesn't give up after a setback; they keep going until they reach their full fulfillment."
"Teniendo todo en cuenta, Maquiavelo creía que los resultados finales siempre justifican los medios utilizados.","Taking everything into account, Machiavelli believed that the final outcomes always justify the means used."
"Bueno, para decirlo de forma sencilla, un espíritu libre es aquel que ha logrado superar sus dudas sobre sí mismo.","Well, to put it simply, a free spirit is one who has managed to overcome their self-doubt."
"Incluso si te sientes desilusionado, recuerda que el hombre superior debe valerse por sí mismo en este mundo implacable.","Even if you feel disillusioned, remember that the superior man must stand on his own 2 feet in this relentless world."
"Me gustaría hablar sobre la importancia del poder; sin embargo, no debemos pasar por alto la necesidad de disciplina.","I’d like to talk about the importance of power; however, we must not overlook the need for discipline."
"Al principio, la gente podría criticarte, pero con el tiempo llegarán a reconocer tu profunda visión de la realidad.","At first, people might criticize you, but in time they will come to recognize your deep insight into reality."
"No solo es una cuestión de ambición, sino más bien de tener la convicción para enfrentar cualquier peligro.","It is not just a matter of ambition, but rather of having the conviction to face any danger."
"A diferencia de lo que la mayoría piensa, un líder no puede permitirse ser blando si quiere evitar la extinción de su legado.","Contrary to what most people think, a leader cannot afford to be soft if they want to avoid the extinction of their legacy."
"Si el guerrero hubiera escuchado sus miedos, habría terminado en la bancarrota moral y espiritual.","If the warrior had listened to their fears, they would have ended up in moral and spiritual bankruptcy."
"A decir verdad, a menudo intentamos sobrecompensar nuestras debilidades mostrándonos falsamente ante los demás.","Truth be told, we often try to overcompensate for our weaknesses by showing off falsely to others."

