esp,ing
"En 1970, el estadounidense promedio consumía aproximadamente 26 galones de leche entera por año.","In 1970, the average American consumed approximately 26 gallons of whole milk per year."
"Esta cifra disminuyó rápidamente, llegando a unos 14 galones en 1990.","This figure declined rapidly, reaching about 14 gallons in 1990."
"El consumo de leche entera continuó cayendo, hasta llegar a unos 7 galones en 2010.","Whole milk intake continued to drop, falling to around 7 gallons by 2010."
"En 2015, la cifra finalizó en apenas 5.5 galones.","In 2015, it finished at just 5.5 gallons."
"Por otro lado, la leche baja en grasa comenzó mucho más baja, en unos 6 galones por persona en 1970.","Low-fat milk, on the other hand, started much lower at roughly 6 gallons per person in 1970."
"Su popularidad aumentó cada año, superando a la leche entera en 1990 con unos 14 galones por persona.","Its popularity increased each year, overtaking whole milk at around 14 gallons per person in 1990."
"Después de este año decisivo, el consumo se mantuvo relativamente estable, fluctuando entre 13 y 15 galones hasta 2010.","After this pivotal year, its consumption remained fairly stable, fluctuating between 13 and 15 gallons up to 2010."
"En 2015, hubo un modesto descenso que redujo la cifra a unos 13 galones.","In 2015, a modest decline brought the figure to about 13 gallons."
"Estas tendencias reflejan un cambio significativo en las preferencias de los consumidores durante 45 años.","These trends reflect a significant shift in consumer preferences over 45 years."
"La leche baja en grasa reemplazó a la leche entera como la bebida de elección.","Low-fat milk replaced whole milk as the beverage of choice."
"La cifra alcanzó un pico de 500 unidades en 2010.","The figure reached a peak of 500 units in 2010."
"Por el contrario, el uso de carbón cayó drásticamente.","In contrast, the use of coal plummeted."
"Las ventas se mantuvieron constantes durante el segundo trimestre.","Sales remained steady during the second quarter."
"La cantidad de visitantes fluctuó a lo largo del año.","The number of visitors fluctuated throughout the year."
"La gran mayoría de los encuestados prefirieron el transporte público.","The vast majority of respondents preferred public transport."
"El consumo de agua aumentó en un 10 por ciento.","Water consumption increased by 10 percent."
"Mientras que el consumo de té subió, el de café bajó ligeramente.","While tea consumption rose, that of coffee fell slightly."
"En resumen, hubo una tendencia ascendente en el uso de internet.","To sum up, there was an upward trend in internet usage."
"Esa es una pregunta muy interesante.","That’s a very interesting question."
"No lo había pensado antes, pero...","I haven’t really thought about that before, but..."
"Déjame ver...","Let me see..."
"Para ser honesto, es una pregunta algo difícil.","To be honest, it’s a bit of a tricky one."
"¿Cómo podría decir esto?","How can I put this?"
"Lo primero que me viene a la mente es...","Off the top of my head, I’d say..."
"Lo que intento decir es...","What I’m trying to say is..."
"En otras palabras...","In other words..."
"Para decirlo de forma sencilla...","To put it simply..."
"De hecho...","As a matter of fact..."
"Básicamente...","Basically..."
"Curiosamente...","Interestingly enough..."
"Supongo que...","I suppose..."
"No soy un experto en esto, pero imagino que...","I’m not an expert on this, but I imagine..."
"Es difícil decirlo con seguridad, pero...","It’s hard to say for sure, but..."
"Esa es una pregunta bastante compleja, déjame pensar.","That is quite a complex question, let me think."
"Si mal no recuerdo...","If I remember rightly..."
"Es una pregunta difícil de responder de inmediato.","That is a tough question to answer straight away."
"Bueno, para ser perfectamente franco...","Well, to be perfectly frank..."
"Supongo que depende de cómo se mire.","I suppose it depends on how you look at it."
"Esa es una forma interesante de plantearlo.","That is an interesting way of putting it."
"Lo que quiero decir con eso es que...","What I mean by that is that..."
"No tengo una opinión firme al respecto, pero...","I don't have a strong opinion on that, but..."
"Si tuviera que adivinar, diría que...","If I had to guess, I would say that..."
"Bueno, dándole vueltas al asunto...","Well, thinking about it..."
"A decir verdad...","Truth be told..."
"Eso es algo en lo que no me he detenido a pensar mucho.","That is something I haven't given much thought to."
"Para ser más preciso...","To be more precise..."
"Como probablemente sepa...","As you probably know..."
"No estoy totalmente seguro, pero creo que...","I'm not entirely sure, but I believe that..."
"El transporte público es barato. Además, es muy eficiente.","Public transport is cheap. In addition, it is very efficient."
"Me gusta la ciudad. Es más, no me veo viviendo en otro lugar.","I love the city. What’s more, I can’t imagine living anywhere else."
"Fumar es caro. Asimismo, es extremadamente perjudicial para la salud.","Smoking is expensive. Furthermore, it is extremely harmful to your health."
"El plan fue un éxito. Sin embargo, todavía hay margen de mejora.","The plan was a success. However, there is still room for improvement."
"Vivir solo es liberador. Por otro lado, puede ser un poco solitario.","Living alone is liberating. On the other hand, it can be a bit lonely."
"Aunque estaba lloviendo, decidimos salir a caminar.","Although it was raining, we decided to go for a walk."
"Hay muchas actividades al aire libre, tales como el senderismo y la pesca.","There are many outdoor activities, such as hiking and fishing."
"Algunas personas prefieren el campo, particularmente los jubilados.","Some people prefer the countryside, particularly retirees."
"No estudió nada. Por lo tanto, reprobó el examen.","He didn't study at all. Therefore, he failed the exam."
"Hubo una sequía. Como resultado, los precios de los alimentos subieron.","There was a drought. As a result, food prices went up."
"En general, el nivel de vida ha mejorado en la última década.","Overall, the standard of living has improved in the last decade."
"En pocas palabras, fue la mejor experiencia de mi vida.","In a nutshell, it was the best experience of my life."
"No solo es una ciudad hermosa, sino que también es muy segura.","Not only is it a beautiful city, but it is also very safe."
"El proyecto se retrasó debido a la falta de fondos.","The project was delayed due to the lack of funding."
"Muchos jóvenes viajan. Para ilustrar esto, mira las estadísticas de mochileros.","Many young people travel. To illustrate this, look at the statistics on backpacking."
"Me gustaría hablar sobre...","I’d like to talk about..."
"Hoy quiero describir...","Today, I want to describe..."
"El tema que he elegido es...","The topic I’ve chosen is..."
"Me gustaría contarte sobre una vez que...","I’d like to tell you about a time when..."
"Esto sucedió cuando...","This happened when..."
"Fue durante...","It was during..."
"Yo estaba con...","I was with..."
"En ese momento, yo estaba...","At that time, I was..."
"Al principio, yo...","At first, I..."
"Entonces, de repente...","Then, suddenly..."
"Después de eso...","After that..."
"A medida que pasaba el tiempo...","As time went on..."
"Al final...","In the end..."
"Me sentí realmente...","I felt really..."
"Estaba tanto emocionado como nervioso.","I was both excited and nervous."
"Sinceramente, fue...","Honestly, it was..."
"Me dio mucha confianza.","It gave me a lot of confidence."
"Estaba realmente asombrado.","I was really amazed."
"Tuve una experiencia maravillosa.","I had a marvelous experience."
"Esta experiencia me enseñó que...","This experience taught me that..."
"Mirando hacia atrás, me doy cuenta de que...","Looking back, I realize..."
"Fue importante porque...","It was important because..."
"Siempre lo recordaré porque...","I will always remember it because..."
"En general, fue una experiencia significativa porque...","Overall, it was a meaningful experience because..."
"Me gustaría hablar sobre una vez que ayudé a mi amigo a prepararse para un examen.","I’d like to talk about a time when I helped my friend prepare for an exam."
"Esto sucedió el semestre pasado durante nuestros exámenes finales.","This happened last semester during our final exams."
"Mi amigo Rohan estaba teniendo dificultades con las matemáticas.","My friend Rohan was struggling with mathematics."
"Al principio, él estaba muy estresado.","At first, he was very stressed."
"Luego, me ofrecí a estudiar con él después de la universidad.","Then, I offered to study with him after college."
"Pasamos dos horas cada día repasando fórmulas y resolviendo problemas.","We spent two hours every day revising formulas and solving problems."
"Me sentí realmente feliz de verlo ganar confianza poco a poco.","I felt really happy to see him slowly gaining confidence."
"Cuando aprobó el examen, me sentí muy orgulloso.","When he passed the exam, I was so proud."
"Esta experiencia me enseñó que ayudar a los demás no solo los beneficia a ellos, sino que también te da una sensación de satisfacción.","This experience taught me that helping others not only benefits them but also gives you a sense of fulfillment."
"Las cifras aumentaron gradualmente durante el año.","The figures rose gradually throughout the year."
"El precio de las acciones se disparó tras la noticia.","Stock prices soared following the news."
"Hubo un crecimiento significativo en el sector tecnológico.","There was a significant growth in the technology sector."
"El número de usuarios cayó drásticamente el mes pasado.","The number of users plummeted last month."
"Hubo un ligero descenso en la temperatura.","There was a slight decline in temperature."
"El consumo de energía se mantuvo constante.","Energy consumption remained steady."
"La tasa de desempleo alcanzó su punto más bajo en 2020.","The unemployment rate hit a low in 2020."
"Las ventas fluctuaron considerablemente en verano.","Sales fluctuated considerably during the summer."
"Hubo un aumento brusco en la demanda.","There was a sharp increase in demand."
"La producción de petróleo se estabilizó tras la crisis.","Oil production stabilized after the crisis."
"De manera similar, el gasto en salud aumentó.","Similarly, spending on healthcare increased."
"Mientras que el uso de trenes subió, el de buses bajó.","While train usage rose, bus usage fell."
"La gran mayoría de la población vive en ciudades.","The vast majority of the population lives in cities."
"Las ventas pasaron de 100 a 500 unidades.","Sales rose from 100 to 500 units."
"La cifra se situó en un 20 por ciento al inicio.","The figure stood at 20 percent at the beginning."
"El gráfico de líneas ilustra el consumo de agua.","The line graph illustrates water consumption."
"Un corte de energía interrumpió la producción.","A power outage interrupted production."
"Ahorrar es importante, pero creo que invertir es mucho más crucial que solo guardar dinero.","Saving is important, but I think investing is much more crucial than just keeping money."
"Él tuvo que esforzarse mucho para obtener su título.","He had to put in the hard yard to get his degree."
"A menudo damos por sentada nuestra salud hasta que enfermamos.","We often take our health for granted until we get sick."
"A ella no le gusta presumir sus habilidades.","She doesn't like to show off her skills."
"Esa es una pregunta muy interesante.","That’s a very interesting question."
"Realmente no lo había pensado antes, pero...","I haven’t really thought about that before, but..."
"Déjame ver...","Let me see..."
"Para ser honesto, es una pregunta algo difícil.","To be honest, it’s a bit of a tricky one."
"¿Cómo podría expresar esto?","How can I put this?"
"Lo primero que se me ocurre es...","Off the top of my head, I’d say..."
"Lo que intento decir es...","What I’m trying to say is..."
"En otras palabras...","In other words..."
"Para decirlo de forma sencilla...","To put it simply..."
"De hecho, déjame reformular eso.","Actually, let me rephrase that."
"De hecho...","As a matter of fact..."
"Para ser totalmente honesto...","To be perfectly honest..."
"Curiosamente...","Interestingly enough..."
"Esencialmente...","Essentially..."
"Supongo que...","I suppose..."
"No soy un experto en esto, pero me imagino que...","I’m not an expert on this, but I imagine..."
"Supongo que se podría decir eso...","I guess you could say that..."
"Es difícil decirlo con seguridad, pero...","It’s hard to say for sure, but..."
"Ese es un tema complejo de considerar, pero desde mi perspectiva...","That's a complex issue to consider, but from my perspective..."
"Bueno, si lo piensas bien...","Well, if you come to think about it..."
"A ver, déjame organizar mis ideas un segundo.","Let me just gather my thoughts for a second."
"A decir verdad, no estoy muy familiarizado con eso, pero...","Truth be told, I'm not that familiar with that, but..."
"Mirándolo desde otro ángulo...","Looking at it from another angle..."
"Lo que quiero decir es que...","What I mean by that is that..."
"Vivir en la ciudad es emocionante. Sin embargo, puede ser muy estresante.","Living in the city is exciting. However, it can be very stressful."
"Por un lado, la tecnología nos conecta; por otro lado, puede aislarnos.","On one hand, technology connects us; on the other hand, it can isolate us."
"Aunque el examen fue difícil, logré pasarlo.","Although the exam was difficult, I managed to pass it."
"A pesar de la lluvia, el evento fue un éxito rotundo.","Despite the rain, the event was a resounding success."
"Muchos países están prohibiendo el plástico, por ejemplo, Canadá y Francia.","Many countries are banning plastic, for instance, Canada and France."
"Hay varios problemas ambientales, tales como la deforestación.","There are several environmental problems, such as deforestation."
"La contaminación aumentó y, por lo tanto, el gobierno tomó medidas.","Pollution increased and, therefore, the government took action."
"Como resultado del cambio climático, los niveles del mar están subiendo.","As a result of climate change, sea levels are rising."
"En pocas palabras, es la mejor solución para el problema actual.","In a nutshell, it is the best solution to the current problem."
"Las ventas de libros electrónicos se dispararon durante la pandemia.","E-book sales rocketed during the pandemic."
"El precio del oro cayó drásticamente el mes pasado.","The price of gold plummeted last month."
"El número de turistas alcanzó un pico de 2 millones en agosto.","The number of tourists reached a peak of 2 million in August."
"Hubo un aumento significativo en el uso de energías renovables.","There was a significant increase in the use of renewable energy."
"Las ganancias se mantuvieron estables durante tres años consecutivos.","Profits remained steady for three consecutive years."
"La cifra se situó en 50 dólares al inicio del periodo.","The figure stood at 50 dollars at the beginning of the period."
"El gráfico de barras describe el gasto en educación por país.","The bar chart depicts the expenditure on education by country."
"El consumo de agua aumentó en un 15 por ciento.","Water consumption increased by 15 percent."
"Mientras que la población urbana creció, la rural disminuyó.","While the urban population grew, the rural population decreased."
"La gran mayoría de la gente prefiere trabajar desde casa.","The vast majority of people prefer to work from home."
"El desempleo cayó de un 10 a un 5 por ciento el año pasado.","Unemployment fell from 10 to 5 percent last year."
"Aprender gramática es importante, pero creo que la fluidez es mucho más crucial que la perfección.","Learning grammar is important, but I think fluency is much more crucial than perfection."
"Aunque el dinero es necesario, diría que el tiempo libre es mucho más valioso que un salario alto.","While money is necessary, I would say that free time is much more valuable than a high salary."
"No se trata solo de la cantidad, sino más bien de la calidad de lo que consumimos.","It is not just about the quantity, but rather the quality of what we consume."
"Mucha gente cree que X es la mejor opción, sin embargo, yo sostengo que Y ofrece mejores resultados.","Many people believe that X is the best option, however, I maintain that Y offers better results."
"En comparación con el pasado, hoy en día es significativamente más fácil acceder a la información.","Compared to the past, nowadays it is significantly easier to access information."
"Hay una distinción clara entre lo que queremos y lo que realmente necesitamos.","There is a clear distinction between what we want and what we actually need."
"Uno de los mayores beneficios de X es que nos permite mejorar nuestras habilidades rápidamente.","One of the major benefits of X is that it allows us to improve our skills rapidly."
"A diferencia de lo que la mayoría piensa, este problema es más complejo de lo que parece a primera vista.","Contrary to what most people think, this issue is more complex than it appears at first glance."
"El impacto de X en la sociedad es tan profundo que no puede ser ignorado.","The impact of X on society is so profound that it cannot be ignored."
"Teniendo todo en cuenta, las ventajas de X superan claramente las desventajas.","Taking everything into account, the advantages of X clearly outweigh the disadvantages."
"Independientemente de lo que uno piense sobre X, es innegable que ha cambiado el mundo.","Regardless of what one thinks about X, it is undeniable that it has changed the world."
"No solo afecta a los individuos, sino que también tiene consecuencias para la comunidad en su conjunto.","Not only does it affect individuals, but it also has consequences for the community as a whole."
"La escuela está situada justo al lado del parque.","The school is situated right next to the park."
"Al norte de la ciudad, se construyó un nuevo hospital.","To the north of the city, a new hospital was built."
"El antiguo almacén fue demolido para dar paso a un centro comercial.","The old warehouse was demolished to make way for a shopping mall."
"En la esquina noreste, hay una pequeña zona residencial.","In the north-east corner, there is a small residential area."
"La zona industrial fue transformada en un parque público.","The industrial zone was transformed into a public park."
"El bosque fue talado y reemplazado por un estacionamiento.","The forest was chopped down and replaced by a parking lot."
"La carretera principal corre paralela al río.","The main road runs parallel to the river."
"Se construyó un puente sobre el río para conectar ambas áreas.","A bridge was built across the river to connect both areas."
"El centro de la ciudad se ha vuelto mucho más peatonal.","The city center has become much more pedestrianized."
"A diferencia del mapa de 1990, la zona actual está más urbanizada.","In contrast to the 1990 map, the current area is more urbanized."
"Mirando el plano, el puerto se encuentra en la parte sur.","Looking at the layout, the harbour is located in the southern part."
"Los edificios residenciales están rodeados de zonas verdes.","The residential buildings are surrounded by green spaces."
"La estación de tren se expandió significativamente en la última década.","The railway station expanded significantly over the last decade."
"En el centro del mapa, el mercado original permanece sin cambios.","In the center of the map, the original market remains unchanged."
"A lo largo de la costa, se han levantado varios hoteles nuevos.","Along the coastline, several new hotels have been erected."
"Aunque el salario es adecuado, la falta de cumplimiento personal me hace querer reevaluar mi carrera.","Although the income is adequate, the lack of personal fulfillment makes me want to reassess my career."
"Debido a la caza furtiva, muchas especies están al borde de la extinción.","Due to poaching, many species are on the brink of extinction."
"Me sentí muy decepcionado cuando me di cuenta de que mi esfuerzo había sido en vano.","I felt really disappointed when I realized that my effort had been in vain."
"No soy un experto, pero imagino que la biodiversidad es vital para la salud del planeta.","I’m not an expert, but I imagine that biodiversity is vital for the planet's health."
"A diferencia de lo que algunos creen, ser un ambivertido es un rasgo de personalidad muy útil.","Contrary to what some believe, being an ambivert is a very useful personality trait."
"El cirujano tuvo que asegurar que la herida fuera hermética después de la cirugía.","The surgeon had to ensure the wound was watertight after the surgery."
"Sinceramente, fue difícil mantener el ritmo de las exigencias implacables de mi jefe.","Honestly, it was hard to keep up with my boss's relentless demands."
"Esta experiencia me enseñó que los reveses son solo oportunidades para ganar fuerza.","This experience taught me that setbacks are just opportunities to gain strength."
"Si tuviera que adivinar, diría que el 'brain fog' se debió al agotamiento extremo.","If I had to guess, I’d say the brain fog was due to extreme burnout."
"A pesar de la fatiga, el buceador mantuvo la calma mientras extraía las muestras.","Despite the fatigue, the diver remained calm while extracting the samples."
"Mirando hacia atrás, me di cuenta de que a menudo damos por sentada nuestra herencia.","Looking back, I realize that we often take our heritage for granted."
"Para ponerlo de forma sencilla, el ritmo circadiano es nuestro reloj biológico interno.","To put it simply, the circadian rhythm is our internal biological clock."
"La gran mayoría de las especies migratorias dependen de la restauración de sus hábitats.","The vast majority of migratory species rely on the restoration of their habitats."
"No solo es una persona habladora, sino que también tiene una visión muy profunda de la vida.","Not only is she a talkative person, but she also has very deep insight into life."
"El impacto de las especies invasoras es tan significativo que no puede ser ignorado.","The impact of invasive species is so significant that it cannot be ignored."
"Teniendo todo en cuenta, el resultado del proyecto superó todas mis expectativas.","Taking everything into account, the outcome of the project exceeded all my expectations."
"Lo que intento decir es que debemos ser realistas sobre nuestras debilidades.","What I’m trying to say is that we must be realistic about our weaknesses."
"La arquitectura antigua es hermosa, pero vivir en ella puede ser poco práctico debido a la humedad.","The ancient architecture is beautiful, but living in it can be impractical due to the dampness."
"Curiosamente, el águila tiene una visión mucho más amplia que los humanos.","Interestingly enough, the eagle has a much wider vision than humans."
"Él tuvo que esforzarse mucho para superar sus sentimientos de duda sobre sí mismo.","He had to put in the hard yard to overcome his feelings of self-doubt."
"Un verdadero emprendedor sabe que los reveses no son fracasos, sino pasos esenciales hacia el éxito.","A true entrepreneur knows that setbacks are not failures, but essential steps toward success."
"En el camino al éxito, debes aprender a valerse por ti mismo y confiar en tu propia fuerza.","On the path to success, you must learn to stand on your own 2 feet and trust your own strength."
"La resiliencia es la armadura del guerrero; te permite continuar a pesar de los obstáculos implacables.","Resilience is the warrior’s armor; it allows you to endure despite relentless obstacles."
"No dejes que el miedo a la desilusión te impida perseguir tus deseos más profundos.","Don't let the fear of disillusionment stop you from pursuing your deepest desires."
"Cuando te sientas agotado, recuerda que el éxito requiere que te esfuerces al máximo cada día.","When you feel burnt out, remember that success requires you to put in the hard yard every day."
"Aunque el camino sea difícil, la satisfacción de alcanzar tu meta superará cualquier fatiga.","Although the path is tough, the fulfillment of reaching your goal will outweigh any fatigue."
"Un guerrero no se rinde ante la derrota; utiliza cada herida y cicatriz como una lección para reevaluar su estrategia.","A warrior does not surrender to defeat; they use every wound and scar as a lesson to reassess their strategy."
"Para lograr algo grande, debes estar dispuesto a sacrificar la comodidad y abrazar la incertidumbre.","To achieve something great, you must be willing to sacrifice comfort and embrace uncertainty."
"A diferencia de los que se rinden, el líder exitoso mantiene su compromiso incluso en los momentos de duda.","Unlike those who give up, the successful leader maintains their commitment even in moments of self-doubt."
"No des por sentada tu visión; protégela con una convicción inquebrantable y un esfuerzo constante.","Don't take your vision for granted; protect it with unwavering conviction and constant effort."
"El impacto de tus acciones hoy determinará la herencia que dejes para el futuro.","The impact of your actions today will determine the heritage you leave for the future."
"Sigue adelante, porque el amanecer siempre llega para aquellos que logran soportar la noche más oscura.","Keep going, because the dawn always comes for those who manage to endure the darkest night."
"Incluso si te sientes inadecuado, recuerda que la maestría nace de la práctica y la dedicación total.","Even if you feel inadequate, remember that mastery is born from practice and total dedication."
