esp,ing
"La tasa de desempleo alcanzó su punto más bajo en 2020.","The unemployment rate hit a low in 2020."
"Las ventas fluctuaron considerablemente en verano.","Sales fluctuated considerably during the summer."
"Hubo un aumento brusco en la demanda.","There was a sharp increase in demand."
"La producción de petróleo se estabilizó tras la crisis.","Oil production stabilized after the crisis."
"De manera similar, el gasto en salud aumentó.","Similarly, spending on healthcare increased."
"Mientras que el uso de trenes subió, el de buses bajó.","While train usage rose, bus usage fell."
"La gran mayoría de la población vive en ciudades.","The vast majority of the population lives in cities."
"Las ventas pasaron de 100 a 500 unidades.","Sales rose from 100 to 500 units."
"La cifra se situó en un 20 por ciento al inicio.","The figure stood at 20 percent at the beginning."
"El gráfico de líneas ilustra el consumo de agua.","The line graph illustrates water consumption."
"Un corte de energía interrumpió la producción.","A power outage interrupted production."
"Ahorrar es importante, pero creo que invertir es mucho más crucial que solo guardar dinero.","Saving is important, but I think investing is much more crucial than just keeping money."
"Él tuvo que esforzarse mucho para obtener su título.","He had to put in the hard yard to get his degree."
"A menudo damos por sentada nuestra salud hasta que enfermamos.","We often take our health for granted until we get sick."
"A ella no le gusta presumir sus habilidades.","She doesn't like to show off her skills."
"Esa es una pregunta muy interesante.","That’s a very interesting question."
"Realmente no lo había pensado antes, pero...","I haven’t really thought about that before, but..."
"Déjame ver...","Let me see..."
"Para ser honesto, es una pregunta algo difícil.","To be honest, it’s a bit of a tricky one."
"¿Cómo podría expresar esto?","How can I put this?"
"Lo primero que se me ocurre es...","Off the top of my head, I’d say..."
"Lo que intento decir es...","What I’m trying to say is..."
"En otras palabras...","In other words..."
"Para decirlo de forma sencilla...","To put it simply..."
"De hecho, déjame reformular eso.","Actually, let me rephrase that."
"De hecho...","As a matter of fact..."
"Para ser totalmente honesto...","To be perfectly honest..."
"Curiosamente...","Interestingly enough..."
"Esencialmente...","Essentially..."
"Supongo que...","I suppose..."
"No soy un experto en esto, pero me imagino que...","I’m not an expert on this, but I imagine..."
"Supongo que se podría decir eso...","I guess you could say that..."
"Es difícil decirlo con seguridad, pero...","It’s hard to say for sure, but..."
"Ese es un tema complejo de considerar, pero desde mi perspectiva...","That's a complex issue to consider, but from my perspective..."
"Bueno, si lo piensas bien...","Well, if you come to think about it..."
"A ver, déjame organizar mis ideas un segundo.","Let me just gather my thoughts for a second."
"A decir verdad, no estoy muy familiarizado con eso, pero...","Truth be told, I'm not that familiar with that, but..."
"Mirándolo desde otro ángulo...","Looking at it from another angle..."
"Lo que quiero decir es que...","What I mean by that is that..."
"Vivir en la ciudad es emocionante. Sin embargo, puede ser muy estresante.","Living in the city is exciting. However, it can be very stressful."
"Por un lado, la tecnología nos conecta; por otro lado, puede aislarnos.","On one hand, technology connects us; on the other hand, it can isolate us."
"Aunque el examen fue difícil, logré pasarlo.","Although the exam was difficult, I managed to pass it."
"A pesar de la lluvia, el evento fue un éxito rotundo.","Despite the rain, the event was a resounding success."
"Muchos países están prohibiendo el plástico, por ejemplo, Canadá y Francia.","Many countries are banning plastic, for instance, Canada and France."
"Hay varios problemas ambientales, tales como la deforestación.","There are several environmental problems, such as deforestation."
"La contaminación aumentó y, por lo tanto, el gobierno tomó medidas.","Pollution increased and, therefore, the government took action."
"Como resultado del cambio climático, los niveles del mar están subiendo.","As a result of climate change, sea levels are rising."
"En pocas palabras, es la mejor solución para el problema actual.","In a nutshell, it is the best solution to the current problem."
"Las ventas de libros electrónicos se dispararon durante la pandemia.","E-book sales rocketed during the pandemic."
"El precio del oro cayó drásticamente el mes pasado.","The price of gold plummeted last month."
"El número de turistas alcanzó un pico de 2 millones en agosto.","The number of tourists reached a peak of 2 million in August."
"Hubo un aumento significativo en el uso de energías renovables.","There was a significant increase in the use of renewable energy."
"Las ganancias se mantuvieron estables durante tres años consecutivos.","Profits remained steady for three consecutive years."
"La cifra se situó en 50 dólares al inicio del periodo.","The figure stood at 50 dollars at the beginning of the period."
"El gráfico de barras describe el gasto en educación por país.","The bar chart depicts the expenditure on education by country."
"El consumo de agua aumentó en un 15 por ciento.","Water consumption increased by 15 percent."
"Mientras que la población urbana creció, la rural disminuyó.","While the urban population grew, the rural population decreased."
"La gran mayoría de la gente prefiere trabajar desde casa.","The vast majority of people prefer to work from home."
"El desempleo cayó de un 10 a un 5 por ciento el año pasado.","Unemployment fell from 10 to 5 percent last year."
"Aprender gramática es importante, pero creo que la fluidez es mucho más crucial que la perfección.","Learning grammar is important, but I think fluency is much more crucial than perfection."
"Aunque el dinero es necesario, diría que el tiempo libre es mucho más valioso que un salario alto.","While money is necessary, I would say that free time is much more valuable than a high salary."
"No se trata solo de la cantidad, sino más bien de la calidad de lo que consumimos.","It is not just about the quantity, but rather the quality of what we consume."
"Mucha gente cree que X es la mejor opción, sin embargo, yo sostengo que Y ofrece mejores resultados.","Many people believe that X is the best option, however, I maintain that Y offers better results."
"En comparación con el pasado, hoy en día es significativamente más fácil acceder a la información.","Compared to the past, nowadays it is significantly easier to access information."
"Hay una distinción clara entre lo que queremos y lo que realmente necesitamos.","There is a clear distinction between what we want and what we actually need."
"Uno de los mayores beneficios de X es que nos permite mejorar nuestras habilidades rápidamente.","One of the major benefits of X is that it allows us to improve our skills rapidly."
"A diferencia de lo que la mayoría piensa, este problema es más complejo de lo que parece a primera vista.","Contrary to what most people think, this issue is more complex than it appears at first glance."
"El impacto de X en la sociedad es tan profundo que no puede ser ignorado.","The impact of X on society is so profound that it cannot be ignored."
"Teniendo todo en cuenta, las ventajas de X superan claramente las desventajas.","Taking everything into account, the advantages of X clearly outweigh the disadvantages."
"Independientemente de lo que uno piense sobre X, es innegable que ha cambiado el mundo.","Regardless of what one thinks about X, it is undeniable that it has changed the world."
"No solo afecta a los individuos, sino que también tiene consecuencias para la comunidad en su conjunto.","Not only does it affect individuals, but it also has consequences for the community as a whole."
"La escuela está situada justo al lado del parque.","The school is situated right next to the park."
"Al norte de la ciudad, se construyó un nuevo hospital.","To the north of the city, a new hospital was built."
"El antiguo almacén fue demolido para dar paso a un centro comercial.","The old warehouse was demolished to make way for a shopping mall."
"En la esquina noreste, hay una pequeña zona residencial.","In the north-east corner, there is a small residential area."
"La zona industrial fue transformada en un parque público.","The industrial zone was transformed into a public park."
"El bosque fue talado y reemplazado por un estacionamiento.","The forest was chopped down and replaced by a parking lot."
"La carretera principal corre paralela al río.","The main road runs parallel to the river."
"Se construyó un puente sobre el río para conectar ambas áreas.","A bridge was built across the river to connect both areas."
"El centro de la ciudad se ha vuelto mucho más peatonal.","The city center has become much more pedestrianized."
"A diferencia del mapa de 1990, la zona actual está más urbanizada.","In contrast to the 1990 map, the current area is more urbanized."
"Mirando el plano, el puerto se encuentra en la parte sur.","Looking at the layout, the harbour is located in the southern part."
"Los edificios residenciales están rodeados de zonas verdes.","The residential buildings are surrounded by green spaces."
"La estación de tren se expandió significativamente en la última década.","The railway station expanded significantly over the last decade."
"En el centro del mapa, el mercado original permanece sin cambios.","In the center of the map, the original market remains unchanged."
"A lo largo de la costa, se han levantado varios hoteles nuevos.","Along the coastline, several new hotels have been erected."
esp,ing
"El gráfico de líneas muestra el consumo per cápita de leche entera y baja en grasa en Estados Unidos.","The line graph illustrates per capita consumption of whole milk and low-fat milk in the United States."
"En general, hubo un descenso drástico en el consumo de leche entera.","Overall, there was a dramatic decline in whole milk consumption."
"Al mismo tiempo, la leche baja en grasa tuvo un aumento constante.","At the same time, low-fat milk saw a steady increase."
"Las dos tendencias se cruzaron alrededor de 1990 en 14 galones por persona.","The two trends crossed at around 14 gallons per person in 1990."
"En 1970, los estadounidenses consumían aproximadamente 26 galones de leche entera por persona al año.","In 1970, Americans consumed around 26 gallons of whole milk per person annually."
"Este número cayó de forma constante hasta llegar a 5 galones en 2015.","This number fell consistently, reaching 5 gallons in 2015."
"El consumo de leche baja en grasa comenzó mucho más bajo, en 6 galones por persona.","Low-fat milk consumption started much lower, at 6 gallons per person."
"Su popularidad creció cada año, superando la leche entera en 1990.","Its popularity grew each year, overtaking whole milk in 1990."
"Después de ese punto, el consumo se mantuvo estable en 13–15 galones.","After that point, consumption stayed stable at 13–15 gallons."
"En 2015, hubo una ligera disminución en el consumo de leche baja en grasa.","In 2015, there was a slight dip in low-fat milk consumption."
"En resumen, la leche entera cayó mientras la leche baja en grasa subió y luego se estabilizó.","To sum up, whole milk consumption fell while low-fat milk rose and then stabilized."
"Esto resalta un cambio significativo en las preferencias de los consumidores a lo largo de 45 años.","This highlights a significant shift in consumer preferences over 45 years."
"El gráfico de barras compara las cifras de ventas en diferentes países.","The bar chart compares sales figures across different countries."
"La tabla muestra cambios en la población urbana entre 1990 y 2020.","The table shows changes in urban population between 1990 and 2020."
"El gráfico circular ilustra la distribución de los ingresos por sector.","The pie chart illustrates the distribution of income by sector."
"Hubo un aumento pronunciado en las exportaciones después del año 2000.","There was a sharp rise in exports after the year 2000."
"Las cifras permanecieron estables durante la primera década.","The figures remained stable during the first decade."
"Se produjo una disminución gradual en la producción de carbón.","There was a gradual decrease in coal production."
"El número alcanzó un máximo de 80 unidades en 2010.","The number reached a peak of 80 units in 2010."
"En contraste, las importaciones cayeron drásticamente.","By contrast, imports fell dramatically."
"El consumo se mantuvo constante en alrededor de 50 litros por persona.","Consumption stayed constant at around 50 liters per person."
"Las cifras tocaron un mínimo histórico en 2005.","The figures hit a historic low in 2005."
"En el período inicial, los valores eran relativamente bajos.","In the initial period, the values were relatively low."
"El crecimiento se aceleró de forma notable después de 2015.","Growth accelerated significantly after 2015."
"En comparación con 1990, los niveles fueron mucho más altos en 2020.","Compared to 1990, the levels were much higher in 2020."
"Los datos destacan una tendencia ascendente clara a lo largo de los años.","The data highlight a clear upward trend over the years."
"En resumen, los gráficos muestran un cambio considerable en los patrones económicos.","In summary, the charts show a considerable change in economic patterns."
"El plano muestra cómo luce actualmente el aeropuerto y cómo se verá después de la remodelación.","The plan shows what the airport looks like now and how it will appear after redevelopment."
"En general, se espera una expansión significativa de las instalaciones.","Overall, a significant expansion of the facilities is expected."
"Actualmente, el aeropuerto cuenta con ocho puertas de embarque.","At present, the airport has eight gates."
"Después de la remodelación, el número de puertas aumentará a dieciocho.","After redevelopment, the number of gates will increase to eighteen."
"Se añadirá un tren aéreo para conectar las puertas.","A sky train will be added to connect the gates."
"Las tiendas estarán ubicadas en la zona de salidas.","Shops will be located in the departures area."
"Habrá un área de entrega de equipaje (bag drop) adicional.","There will be an additional bag drop area."
"Se instalará un cajero automático en la zona de llegadas.","An ATM will be installed in the arrivals area."
"Los pasajeros podrán alquilar coches tras pasar por la aduana.","Passengers will be able to hire cars after going through customs."
"En la versión actual, los servicios son limitados a un café y el control de pasaportes.","In the current version, services are limited to a café and passport control."
"En contraste, el nuevo diseño incluye más servicios para los pasajeros.","By contrast, the new design includes more passenger services."
"El flujo de pasajeros se gestionará mediante pasillos y un tren aéreo.","Passenger flow will be managed through walkways and a sky train."
"En resumen, el aeropuerto pasará de ser una instalación básica a una más moderna y funcional.","In summary, the airport will change from a basic facility to a more modern and functional one."
"Las tablas comparan las ventas de granos de cacao y café en cinco países europeos en 2000 y 2005.","The tables compare the sales of cocoa beans and coffee in five European countries in 2000 and 2005."
"En general, todas las naciones experimentaron un crecimiento significativo en las ventas.","Overall, all nations experienced significant growth in sales."
"El Reino Unido registró con diferencia las cifras más altas en la venta de café.","The United Kingdom recorded by far the highest figures in coffee sales."
"Las ventas de cacao en Alemania casi se duplicaron en el período.","Cocoa sales in Germany nearly doubled over the period."
"Francia mostró un aumento constante tanto en cacao como en café.","France showed a steady increase in both cocoa and coffee."
"Las ventas en los Países Bajos fueron las más bajas, aunque también crecieron.","Sales in the Netherlands were the lowest, although they also grew."
"En Suiza, las cifras de café casi se duplicaron, mientras que el cacao permaneció bajo.","In Switzerland, coffee figures almost doubled, whereas cocoa remained low."
"El Reino Unido duplicó sus ventas de café, alcanzando 137 millones de euros en 2005.","The UK doubled its coffee sales, reaching 137 million euros in 2005."
"En contraste, Suiza reportó las cifras más bajas para el cacao en ambos años.","By contrast, Switzerland reported the lowest cocoa figures in both years."
"El crecimiento en las ventas de cacao fue más pronunciado en el Reino Unido.","Growth in cocoa sales was most pronounced in the United Kingdom."
"Las cifras de Francia pasaron de 4.6 a 9.3 millones de euros en cacao.","France’s figures rose from 4.6 to 9.3 million euros in cocoa."
"En resumen, mientras todos los países aumentaron sus ventas, el Reino Unido lideró en café y Alemania en cacao.","In summary, while all countries increased their sales, the UK led in coffee and Germany in cocoa."
"Los gráficos circulares comparan la producción de electricidad por fuente de energía en Dinamarca y Alemania en 1978 y 1998.","The pie charts compare electricity production by fuel source in Denmark and Germany in 1978 and 1998."
"En general, ambas naciones duplicaron aproximadamente su producción total de electricidad.","Overall, both nations roughly doubled their total electricity output."
"En Dinamarca, el carbón fue la fuente dominante en ambos años.","In Denmark, coal was the dominant source in both years."
"La dependencia del carbón en Dinamarca aumentó significativamente de 53 a 122 unidades.","Denmark’s reliance on coal rose significantly from 53 to 122 units."
"Las demás fuentes en Dinamarca se redujeron en proporción, destacando la caída del petróleo.","Other sources in Denmark declined proportionally, notably oil."
"En Alemania, la producción de electricidad provenía de una mezcla más equilibrada en 1978.","In Germany, electricity production came from a more balanced mix in 1978."
"Para 1998, la energía nuclear se convirtió en la fuente principal en Alemania.","By 1998, nuclear power became the main source in Germany."
"El uso de energía nuclear en Alemania aumentó drásticamente de 5 a 111 unidades.","Germany’s nuclear power use rose dramatically from 5 to 111 units."
"La proporción de hidroenergía y gas natural en Alemania disminuyó con el tiempo.","The share of hydro power and natural gas in Germany decreased over time."
"En contraste, Dinamarca dependió casi exclusivamente del carbón en 1998.","By contrast, Denmark relied almost exclusively on coal in 1998."
"En resumen, Dinamarca reforzó su dependencia del carbón, mientras que Alemania se orientó hacia la energía nuclear.","In summary, Denmark reinforced its reliance on coal, whereas Germany shifted towards nuclear energy."
"Las personas pueden enfrentar serios problemas sociales y prácticos al vivir en un país extranjero.","People can face serious social and practical problems while living in a foreign country."
"Las barreras lingüísticas dificultan la integración social.","Language barriers make social integration difficult."
"Puede ser complicado acceder a servicios básicos como salud y transporte.","It can be challenging to access basic services such as healthcare and transport."
"La falta de dominio del idioma puede generar aislamiento social.","A lack of language proficiency can lead to social isolation."
"Dominar un idioma extranjero abre oportunidades culturales y profesionales.","Mastering a foreign language opens cultural and professional opportunities."
"Algunos argumentan que los problemas prácticos superan los beneficios.","Some argue that the practical problems outweigh the benefits."
"Otros sostienen que las dificultades iniciales se pueden superar con esfuerzo.","Others claim that the initial difficulties can be overcome with effort."
"Estoy de acuerdo en que las barreras lingüísticas crean obstáculos significativos.","I agree that language barriers create significant obstacles."
"No estoy de acuerdo con la idea de que sea imposible adaptarse.","I disagree with the idea that it is impossible to adapt."
"En mi experiencia, aprender el idioma local facilitó mi integración.","In my experience, learning the local language facilitated my integration."
"Un ejemplo claro es la dificultad para encontrar empleo sin habilidades lingüísticas.","A clear example is the difficulty in finding employment without language skills."
"En resumen, aunque existen problemas sociales y prácticos, estos pueden resolverse con el tiempo.","In conclusion, although social and practical problems exist, they can be resolved over time."
"Es esencial proporcionar ejemplos relevantes para apoyar la opinión.","It is essential to provide relevant examples to support the opinion."
"Este tema destaca la importancia de la comunicación intercultural.","This issue highlights the importance of intercultural communication."
"Los mapas muestran cómo cambió la biblioteca de la ciudad entre 2000 y 2013.","The maps show how the town library changed between 2000 and 2013."
"En general, la biblioteca se modernizó y se transformó en un espacio más digital e interactivo.","Overall, the library was modernised and transformed into a more digital and interactive space."
"Las estanterías de libros fueron eliminadas y reemplazadas por un área de medios digitales.","The bookshelves were removed and replaced with a digital media area."
"Las mesas de lectura desaparecieron y fueron sustituidas por cubículos de estudio.","The reading tables were removed and replaced with study pods."
"Se añadió una zona interactiva para niños en la esquina inferior izquierda.","A children’s interactive zone was added in the bottom left corner."
"El mostrador de recepción fue reemplazado por quioscos de autoservicio.","The reception desk was replaced with self-checkout kiosks."
"En la parte inferior derecha se instaló un área de soporte técnico.","A tech support desk was installed in the bottom right corner."
"La oficina del bibliotecario ya no aparece en el nuevo diseño.","The librarian’s office is no longer present in the new layout."
"Los cambios reflejan una transición hacia recursos tecnológicos y servicios digitales.","The changes reflect a shift towards technological resources and digital services."
"En contraste con el diseño anterior, el nuevo enfatiza el autoservicio y el acceso digital.","In contrast with the earlier layout, the new one emphasizes self-service and digital access."
"En resumen, la biblioteca pasó de ser un espacio tradicional de lectura a uno moderno e interactivo.","In summary, the library changed from a traditional reading space to a modern, interactive one."
"El gráfico de barras muestra la cantidad total de minutos en miles de millones gastados en llamadas telefónicas en Australia entre 1998 y 2005.","The bar chart shows the total number of minutes in billions spent on telephone calls in Australia between 1998 and 2005."
"En general, las llamadas locales fueron las más populares, mientras que las internacionales y móviles mostraron un crecimiento constante.","Overall, local calls were the most popular, whereas national and international calls and mobiles showed steady growth."
"Las llamadas locales alcanzaron un máximo de 72 mil millones de minutos en 2001.","Local calls peaked at 72 billion minutes in 2001."
"Después de 2001, las llamadas locales disminuyeron gradualmente hasta 2005.","After 2001, local calls declined gradually until 2005."
"Las llamadas nacionales e internacionales aumentaron de manera constante a lo largo del período.","National and international calls increased steadily throughout the period."
"Las cifras pasaron de alrededor de 30 mil millones en 1998 a más de 60 mil millones en 2005.","The figures rose from around 30 billion in 1998 to over 60 billion in 2005."
"Las llamadas móviles comenzaron en un nivel bajo en 1998 con apenas 2 mil millones de minutos.","Mobile calls started at a low level in 1998 with only 2 billion minutes."
"El uso de móviles creció drásticamente, llegando a 46 mil millones en 2005.","Mobile usage grew dramatically, reaching 46 billion in 2005."
"En contraste con la caída de las llamadas locales, las móviles mostraron el crecimiento más rápido.","In contrast to the decline in local calls, mobiles showed the fastest growth."
"En resumen, mientras las llamadas locales dominaron al inicio, hacia 2005 las internacionales y móviles se expandieron de manera significativa.","In summary, while local calls dominated at the beginning, by 2005 international and mobile calls had expanded significantly."
"El gráfico de líneas ilustra el consumo per cápita de leche entera y baja en grasa en Estados Unidos entre 1970 y 2015.","The line graph illustrates the per capita consumption of whole and low-fat milk in the United States from 1970 to 2015."
"En general, hubo una disminución sustancial en el consumo de leche entera.","Overall, there was a substantial decrease in whole milk consumption."
"Al mismo tiempo, el consumo de leche baja en grasa aumentó drásticamente hasta convertirse en el tipo más popular.","At the same time, the intake of low-fat milk rose sharply until it became the most popular type."
"Después de superar a la leche entera en 1990, el consumo de leche baja en grasa se estabilizó.","After surpassing whole milk in 1990, low-fat milk consumption stabilized."
