esp,ing
"El gráfico de líneas compara el porcentaje de energía renovable utilizada en cuatro países —Alemania, Francia, Estados Unidos y China— entre los años 2013 y 2019.","The line graph compares the percentage of renewable energy used in four countries—Germany, France, the United States, and China—between the years 2013 and 2019."
"En términos generales, todos los países mostraron un aumento significativo en el uso de energías renovables durante el período analizado, aunque con ritmos de crecimiento variados.","Overall, all countries displayed a significant increase in the use of renewable energy during the analyzed period, albeit with varying rates of growth."
"En 2013, Alemania lideraba el grupo con un 25% de energía proveniente de fuentes renovables, mientras que Francia y Estados Unidos registraban alrededor del 15%, y China solo un 10%.","In 2013, Germany led the group with 25% of energy coming from renewable sources, while France and the United States registered around 15%, and China only 10%."
"A lo largo de los siguientes tres años, Alemania mantuvo un crecimiento constante, alcanzando el 35% en 2016, mientras que Francia y Estados Unidos experimentaron una leve subida del 5%.","Over the next three years, Germany maintained steady growth, reaching 35% in 2016, whereas France and the United States experienced a slight increase of 5%."
"En contraste, el uso de energías renovables en China permaneció estancado hasta 2015, momento en el cual se implementaron políticas gubernamentales agresivas para fomentar las energías limpias.","In contrast, the use of renewable energy in China remained stagnant until 2015, at which point aggressive governmental policies were implemented to promote clean energy."
"Como resultado de estas políticas, China experimentó un crecimiento exponencial, superando a Estados Unidos y Francia en 2017 con un 30% de energía renovable.","As a result of these policies, China experienced exponential growth, surpassing both the United States and France in 2017 with 30% renewable energy."
"En 2018, el porcentaje de energía renovable en Alemania se estancó en un 40%, probablemente debido a la saturación del mercado y a la falta de capacidad de almacenamiento eficiente.","In 2018, the percentage of renewable energy in Germany plateaued at 40%, probably due to market saturation and a lack of efficient storage capacity."
"Durante el mismo período, Francia continuó aumentando de forma constante, mientras que Estados Unidos mostró un crecimiento errático, lo cual podría atribuirse a cambios en la administración y a la retirada de acuerdos internacionales de energía.","During the same period, France continued to rise steadily, while the United States exhibited erratic growth, which could be attributed to administrative changes and the withdrawal from international energy agreements."
"En cuanto a la comparación final en 2019, China y Alemania estaban casi a la par, con un 45% y 43% respectivamente, seguidos por Francia con un 30% y Estados Unidos, a la zaga con un 25%.","As for the final comparison in 2019, China and Germany were nearly on par, with 45% and 43% respectively, followed by France at 30% and the United States lagging behind at 25%."
"Si bien el crecimiento de China ha sido impresionante, algunos informes internos indicaron que su sistema de almacenamiento no estaba preparado para el rápido incremento de producción de energía limpia.","Although China’s growth has been impressive, some internal reports indicated that its storage system was not prepared for the rapid increase in clean energy production."
"Además, se sugirió que si Alemania hubiera mejorado su capacidad de almacenamiento, podría haber alcanzado o incluso superado el nivel de China en 2019.","Furthermore, it was suggested that if Germany had improved its storage capacity, it could have reached or even surpassed China’s level in 2019."
"En última instancia, el gráfico sugiere que, aunque todos los países han incrementado el uso de energías renovables, la tasa de adopción y los desafíos han sido diferentes para cada nación.","Ultimately, the graph suggests that although all countries have increased their use of renewable energy, the rate of adoption and the challenges faced have been different for each nation."
"En conclusión, Alemania y China demostraron ser los líderes en la transición hacia energías limpias, mientras que Francia mostró un progreso constante y Estados Unidos permaneció rezagado debido a su enfoque inconsistente.","In conclusion, Germany and China proved to be the leaders in the transition towards clean energy, while France showed steady progress, and the United States remained behind due to its inconsistent approach."
