esp,ing
"Mi pasatiempo favorito es el jiujitsu brasileño.","My favorite hobby is Brazilian jiujitsu."
"Lo descubrí por casualidad cuando buscaba cursos en la universidad.","I discovered it by chance when I was looking for courses at university."
"Ya había inscrito todas mis clases académicas.","I had already registered for all my academic classes."
"Quería probar algo nuevo.","I wanted to try something new."
"Vi que el departamento deportivo ofrecía jiujitsu.","I saw that the sports department offered jiujitsu."
"Decidí intentarlo.","I decided to give it a try."
"Al principio no sabía mucho sobre el deporte.","At first, I didn’t know much about the sport."
"Después de unas sesiones me enganché.","After a few sessions, I got hooked."
"Practiqué jiujitsu en la universidad durante varios años.","I practiced jiujitsu at university for several years."
"Me encantaba cómo combinaba ejercicio y estrategia.","I loved how it combined exercise and strategy."
"Lo que más me gusta es que no usa golpes ni patadas.","What I like most is that it doesn’t use punches or kicks."
"Se basa en técnicas de agarre y sumisión.","It focuses on grappling and submission techniques."
"Hay que mantener la calma bajo presión.","You have to stay calm under pressure."
"Te hace pensar críticamente en cada movimiento.","It makes you think critically about every move."
"Ahora no entreno tan seguido como antes.","Now I don’t train as often as I used to."
"Empecé un nuevo trabajo y mi horario está lleno.","I started a new job and my schedule is full."
"A veces practico en un centro deportivo cerca de casa.","Sometimes I practice at a sports center near home."
"Mi objetivo es volver a entrenar regularmente.","My goal is to return to training regularly."
"El jiujitsu me ha enseñado paciencia y disciplina.","Jiujitsu has taught me patience and discipline."
"También me ayuda a aliviar el estrés.","It also helps me relieve stress."
"Quiero que sea una parte importante de mi vida otra vez.","I want it to be an important part of my life again."
"Mi festividad favorita es la Navidad.","My favorite holiday is Christmas."
"La celebro cada año con mi familia.","I celebrate it every year with my family."
"Nos reunimos en casa de mis abuelos.","We gather at my grandparents’ house."
"La casa se decora con luces y un árbol.","The house is decorated with lights and a tree."
"Ponemos música navideña todo el día.","We play Christmas music all day."
"Preparamos una gran cena juntos.","We prepare a big dinner together."
"Comemos platos especiales como pavo y postres.","We eat special dishes like turkey and desserts."
"Después de cenar, intercambiamos regalos.","After dinner, we exchange gifts."
"Me gusta ver las caras felices de mi familia.","I like seeing my family’s happy faces."
"También recordamos momentos especiales del año.","We also remember special moments from the year."
"Lo que más disfruto es el ambiente de amor.","What I enjoy most is the atmosphere of love."
"La Navidad me hace sentir agradecido.","Christmas makes me feel grateful."
"Es una época para compartir y dar.","It’s a time to share and give."
"También descansamos y nos relajamos.","We also rest and relax."
"Me encanta ver películas navideñas.","I love watching Christmas movies."
"Todo se siente más cálido y especial.","Everything feels warmer and more special."
"Es una tradición que espero cada año.","It’s a tradition I look forward to every year."
"La Navidad me une más con mis seres queridos.","Christmas brings me closer to my loved ones."
"Siempre guardo buenos recuerdos de esta fecha.","I always keep good memories of this holiday."
"Por eso, la Navidad es mi festividad favorita.","That’s why Christmas is my favorite holiday."
"Mi estación favorita es el invierno.","My favorite season is winter."
"Me gusta porque el clima es frío.","I like it because the weather is cold."
"Puedo usar ropa abrigada como bufandas y chaquetas.","I can wear warm clothes like scarves and jackets."
"Me encanta tomar bebidas calientes.","I love drinking hot beverages."
"Todo se siente más tranquilo y acogedor.","Everything feels more peaceful and cozy."
"Cuando nieva, el paisaje se vuelve mágico.","When it snows, the landscape becomes magical."
"Me gusta ver caer la nieve por la ventana.","I enjoy watching the snow fall through the window."
"En invierno paso más tiempo con mi familia.","In winter, I spend more time with my family."
"También disfruto quedarme en casa con una manta.","I also enjoy staying home with a blanket."
"Veo películas o leo libros en los días fríos.","I watch movies or read books on cold days."
"Las fiestas como Navidad y Año Nuevo son en invierno.","Holidays like Christmas and New Year happen in winter."
"Eso hace que esta estación sea aún más especial.","That makes this season even more special."
"Me gusta caminar en la calle cuando el aire es fresco.","I like walking outside when the air is crisp."
"Las luces de las ciudades se ven más bonitas en invierno.","City lights look more beautiful in winter."
"Aunque hace frío, se siente muy cálido por dentro.","Even though it’s cold, it feels very warm inside."
"Me encanta la sensación del aire helado en la cara.","I love the feeling of cold air on my face."
"El invierno me da una sensación de calma y reflexión.","Winter gives me a sense of calm and reflection."
"Es una época perfecta para descansar y recargar energía.","It’s a perfect time to rest and recharge."
"Por eso, el invierno es mi estación favorita.","That’s why winter is my favorite season."
"Mi animal favorito es el perro.","My favorite animal is the dog."
"Me gustan porque son leales y cariñosos.","I like them because they are loyal and affectionate."
"Siempre están felices de verte.","They are always happy to see you."
"Los perros son buenos compañeros.","Dogs are great companions."
"Me hacen sentir acompañado y protegido.","They make me feel accompanied and protected."
"Algunos perros pueden ayudarte a cuidar la casa.","Some dogs can help you guard the house."
"También pueden ser entrenados para muchas tareas.","They can also be trained for many tasks."
"Me gusta sacar a pasear a mi perro.","I like taking my dog for a walk."
"Es divertido jugar con ellos en el parque.","It’s fun to play with them in the park."
"Los perros entienden tus emociones.","Dogs understand your emotions."
"A veces, parecen saber cuándo estás triste.","Sometimes, they seem to know when you’re sad."
"Mi perro me alegra el día con solo una mirada.","My dog brightens my day with just one look."
"Hay muchas razas de perros y todas son especiales.","There are many dog breeds and they are all special."
"Me gustan tanto los perros grandes como los pequeños.","I like both big and small dogs."
"Los perros tienen una gran energía.","Dogs have a lot of energy."
"También pueden ser muy tranquilos y tiernos.","They can also be very calm and sweet."
"Me encanta acariciar a mi perro cuando estoy en casa.","I love petting my dog when I’m at home."
"Los perros hacen la vida más feliz.","Dogs make life happier."
"Por eso, el perro es mi animal favorito.","That’s why the dog is my favorite animal."
"Mi cuarto favorito de la casa es el estudio.","My favorite room in the house is the study."
"Es el lugar donde paso la mayor parte del tiempo.","It’s the place where I spend most of my time."
"Uso el estudio para trabajar, estudiar y jugar.","I use the study to work, study, and play."
"Tengo varios computadores en el estudio.","I have several computers in the study."
"También hay una mesa grande con mis equipos.","There’s also a large desk with my equipment."
"Todo está organizado para ser cómodo y práctico.","Everything is organized to be comfortable and practical."
"Me gusta porque es mi espacio personal.","I like it because it’s my personal space."
"En este cuarto puedo concentrarme sin distracciones.","In this room, I can focus without distractions."
"También lo uso para mis hobbies y proyectos.","I also use it for my hobbies and projects."
"Tengo sillas cómodas y buena iluminación.","I have comfortable chairs and good lighting."
"Me gusta personalizarlo con objetos que me inspiran.","I like to personalize it with things that inspire me."
"Cuando estoy en el estudio, me siento productivo.","When I’m in the study, I feel productive."
"También lo uso para relajarme viendo series o jugando.","I also use it to relax watching shows or playing games."
"Todo lo que necesito está en ese espacio.","Everything I need is in that space."
"Por eso, el estudio es mi cuarto favorito.","That’s why the study is my favorite room."
"Mi comida favorita es el pollo con champiñones.","My favorite meal is chicken with mushrooms."
"Me encanta su sabor cremoso y suave.","I love its creamy and smooth flavor."
"Es una combinación que nunca falla.","It’s a combination that never fails."
"Puedo comerlo en muchas preparaciones diferentes.","I can eat it in many different ways."
"Una de mis formas favoritas es en pizza.","One of my favorite ways is on pizza."
"También me gusta en lasaña con salsa blanca.","I also like it in lasagna with white sauce."
"A veces lo como con arroz o pasta.","Sometimes I eat it with rice or pasta."
"Cuando lo preparo en casa, uso crema y especias.","When I cook it at home, I use cream and spices."
"Es una comida que disfruto solo o con familia.","It’s a meal I enjoy alone or with family."
"El pollo con champiñones siempre me hace feliz.","Chicken with mushrooms always makes me happy."
"Me gusta el aroma cuando se está cocinando.","I like the smell when it’s cooking."
"Es una comida que me reconforta.","It’s a comforting meal for me."
"Nunca me canso de su sabor.","I never get tired of its flavor."
"Lo pido a menudo cuando salgo a comer.","I often order it when I eat out."
"Por eso, el pollo con champiñones es mi comida favorita.","That’s why chicken with mushrooms is my favorite meal."
"Mi momento favorito del día es la medianoche.","My favorite time of day is midnight."
"Me gusta cuando ya es de noche y todo está en silencio.","I like it when it’s already night and everything is quiet."
"Es cuando puedo concentrarme mejor.","It’s when I can focus better."
"Uso ese tiempo para trabajar en mis proyectos personales.","I use that time to work on my personal projects."
"No hay ruidos ni distracciones.","There are no noises or distractions."
"La casa está tranquila y todo está en calma.","The house is peaceful and everything is calm."
"Siento que es un tiempo solo para mí.","I feel like it’s time just for me."
"Es cuando soy más creativo.","It’s when I’m most creative."
"Puedo pensar con claridad y avanzar en mis ideas.","I can think clearly and make progress on my ideas."
"A veces escucho música suave mientras trabajo.","Sometimes I listen to soft music while I work."
"Otras veces solo disfruto del silencio total.","Other times I just enjoy total silence."
"Me gusta la sensación de estar despierto mientras todos duermen.","I like the feeling of being awake while everyone else sleeps."
"También es un buen momento para reflexionar.","It’s also a good time to reflect."
"La noche me inspira a seguir aprendiendo y creando.","The night inspires me to keep learning and creating."
"Por eso, la medianoche es mi momento favorito del día.","That’s why midnight is my favorite time of day."
"Me gusta visitar Estados Unidos.","I like to visit the United States."
"Especialmente me gusta el MIT.","I especially like MIT."
"Es una universidad muy famosa.","It’s a very famous university."
"Los laboratorios del MIT son increíbles.","The labs at MIT are amazing."
"Tienen tecnología de muy alto nivel.","They have very high-tech equipment."
"Me inspiran los proyectos que hacen allí.","I’m inspired by the projects they do there."
"En el MIT trabajan en problemas reales.","At MIT, they work on real-world problems."
"Hay muchas personas inteligentes y creativas.","There are many smart and creative people."
"Visitar MIT me motiva a aprender más.","Visiting MIT motivates me to learn more."
"Me gustaría estudiar o investigar allí algún día.","I’d like to study or do research there someday."
"Es un lugar que admiro mucho.","It’s a place I admire a lot."
"Por eso, me gusta visitar el MIT.","That’s why I like visiting MIT."
